A1: Castlemartyr GAA Golf Society
A2: 2008 Golfer of the Year Table [best 5 goy pts to count]
A3: 10pts awarded to winner, 9pts to runner up, 8, 7, 6…….1
D5: Fota (16/02/08) | H5: Dundrum (10/05/08) | L5: Waterrock (27/07/08) | P5: Dungarvan (30/08/08) | T5: Kilkenny G.C. (27/09/08) | X5: Castlemartyr (18/10/08)
B6: Total | D6: hcap | E6: score | F6: goy pts | H6: hcap | I6: score | J6: goy pts | L6: hcap | M6: score | N6: goy pts | P6: hcap | Q6: score | R6: goy pts | T6: hcap | U6: score | V6: goy pts | X6: hcap | Y6: score | Z6: goy pts
A7: Cha O'Neill - Winner! | B7: =LARGE(AP7:AU7,1) + LARGE(AP7:AU7,2) + LARGE(AP7:AU7,3) + LARGE(AP7:AU7,4) + LARGE(AP7:AU7,5) -> 31 | D7: 18 | E7: 32 | F7: 6 | H7: 18 | I7: 20 | J7: 1 | L7: 19 | M7: 37 | N7: 9 | P7: 19 | Q7: 37 | R7: 8 | V7: 0 | X7: 20 | Y7: 36 | Z7: 7 | AP7: =F7 -> 6 | AQ7: =J7 -> 1 | AR7: =N7 -> 9 | AS7: =R7 -> 8 | AT7: =V7 -> 0 | AU7: =Z7 -> 7
A8: Patrick Walsh | B8: =LARGE(AP8:AU8,1) + LARGE(AP8:AU8,2) + LARGE(AP8:AU8,3) + LARGE(AP8:AU8,4) + LARGE(AP8:AU8,5) -> 30 | D8: 13 | E8: 37 | F8: 10 | H8: 13 | I8: 34 | J8: 10 | L8: 13 | M8: 34 | N8: 4 | V8: 0 | X8: 14 | Y8: 34 | Z8: 6 | AP8: =F8 -> 10 | AQ8: =J8 -> 10 | AR8: =N8 -> 4 | AS8: =R8 -> 0 | AT8: =V8 -> 0 | AU8: =Z8 -> 6
A9: Steve O'Donoghue | B9: =LARGE(AP9:AU9,1) + LARGE(AP9:AU9,2) + LARGE(AP9:AU9,3) + LARGE(AP9:AU9,4) + LARGE(AP9:AU9,5) -> 23 | D9: 19 | E9: 28 | F9: 1 | H9: 20 | I9: 26 | J9: 6 | L9: 19 | M9: 33 | N9: 5 | P9: 19 | Q9: 40 | R9: 10 | V9: 0 | Z9: 1 | AP9: =F9 -> 1 | AQ9: =J9 -> 6 | AR9: =N9 -> 5 | AS9: =R9 -> 10 | AT9: =V9 -> 0 | AU9: =Z9 -> 1
A10: Mick Carroll | B10: =LARGE(AP10:AU10,1) + LARGE(AP10:AU10,2) + LARGE(AP10:AU10,3) + LARGE(AP10:AU10,4) + LARGE(AP10:AU10,5) -> 21 | D10: 22 | E10: 27 | F10: 1 | H10: 22 | I10: 23 | J10: 2 | L10: 22 | M10: 35 | N10: 8 | P10: 22 | Q10: 39 | R10: 9 | V10: 0 | Z10: 1 | AP10: =F10 -> 1 | AQ10: =J10 -> 2 | AR10: =N10 -> 8 | AS10: =R10 -> 9 | AT10: =V10 -> 0 | AU10: =Z10 -> 1
A11: Richard Ahern | B11: =LARGE(AP11:AU11,1) + LARGE(AP11:AU11,2) + LARGE(AP11:AU11,3) + LARGE(AP11:AU11,4) + LARGE(AP11:AU11,5) -> 19 | D11: 12 | E11: 37 | F11: 9 | H11: 12 | I11: 33 | J11: 9 | V11: 0 | Z11: 1 | AP11: =F11 -> 9 | AQ11: =J11 -> 9 | AR11: =N11 -> 0 | AS11: =R11 -> 0 | AT11: =V11 -> 0 | AU11: =Z11 -> 1
A12: Fergus Lynch | B12: =LARGE(AP12:AU12,1) + LARGE(AP12:AU12,2) + LARGE(AP12:AU12,3) + LARGE(AP12:AU12,4) + LARGE(AP12:AU12,5) -> 19 | D12: 18 | E12: 34 | F12: 8 | L12: 18 | M12: 32 | N12: 3 | P12: 19 | Q12: 36 | R12: 7 | V12: 0 | Z12: 1 | AP12: =F12 -> 8 | AQ12: =J12 -> 0 | AR12: =N12 -> 3 | AS12: =R12 -> 7 | AT12: =V12 -> 0 | AU12: =Z12 -> 1
A13: Jim Brickley | B13: =LARGE(AP13:AU13,1) + LARGE(AP13:AU13,2) + LARGE(AP13:AU13,3) + LARGE(AP13:AU13,4) + LARGE(AP13:AU13,5) -> 18 | D13: 13 | E13: 31 | F13: 5 | P13: 14 | Q13: 31 | R13: 3 | V13: 0 | X13: 14 | Y13: 39 | Z13: 10 | AP13: =F13 -> 5 | AQ13: =J13 -> 0 | AR13: =N13 -> 0 | AS13: =R13 -> 3 | AT13: =V13 -> 0 | AU13: =Z13 -> 10
A14: Damien Roche | B14: =LARGE(AP14:AU14,1) + LARGE(AP14:AU14,2) + LARGE(AP14:AU14,3) + LARGE(AP14:AU14,4) + LARGE(AP14:AU14,5) -> 16 | D14: 14 | E14: 32 | F14: 7 | H14: 14 | I14: 24 | J14: 4 | P14: 14 | Q14: 34 | R14: 5 | V14: 0 | AP14: =F14 -> 7 | AQ14: =J14 -> 4 | AR14: =N14 -> 0 | AS14: =R14 -> 5 | AT14: =V14 -> 0 | AU14: =Z14 -> 0
A15: Conor Roche | B15: =LARGE(AP15:AU15,1) + LARGE(AP15:AU15,2) + LARGE(AP15:AU15,3) + LARGE(AP15:AU15,4) + LARGE(AP15:AU15,5) -> 13 | D15: 16 | E15: 30 | F15: 2 | H15: 16 | I15: 30 | J15: 8 | V15: 0 | X15: 16 | Y15: 33 | Z15: 3 | AP15: =F15 -> 2 | AQ15: =J15 -> 8 | AR15: =N15 -> 0 | AS15: =R15 -> 0 | AT15: =V15 -> 0 | AU15: =Z15 -> 3
A16: Martina O'Halloran | B16: =LARGE(AP16:AU16,1) + LARGE(AP16:AU16,2) + LARGE(AP16:AU16,3) + LARGE(AP16:AU16,4) + LARGE(AP16:AU16,5) -> 12 | D16: 20 | E16: 22 | F16: 1 | H16: 20 | I16: 15 | J16: 1 | L16: 20 | M16: 33 | N16: 6 | P16: 20 | Q16: 34 | R16: 4 | V16: 0 | AP16: =F16 -> 1 | AQ16: =J16 -> 1 | AR16: =N16 -> 6 | AS16: =R16 -> 4 | AT16: =V16 -> 0 | AU16: =Z16 -> 0
A17: John Roche | B17: =LARGE(AP17:AU17,1) + LARGE(AP17:AU17,2) + LARGE(AP17:AU17,3) + LARGE(AP17:AU17,4) + LARGE(AP17:AU17,5) -> 12 | H17: 16 | I17: 28 | J17: 7 | V17: 0 | X17: 16 | Y17: 34 | Z17: 5 | AP17: =F17 -> 0 | AQ17: =J17 -> 7 | AR17: =N17 -> 0 | AS17: =R17 -> 0 | AT17: =V17 -> 0 | AU17: =Z17 -> 5
A18: Eamon Roche | B18: =LARGE(AP18:AU18,1) + LARGE(AP18:AU18,2) + LARGE(AP18:AU18,3) + LARGE(AP18:AU18,4) + LARGE(AP18:AU18,5) -> 10 | L18: 11 | M18: 38 | N18: 10 | V18: 0 | AP18: =F18 -> 0 | AQ18: =J18 -> 0 | AR18: =N18 -> 10 | AS18: =R18 -> 0 | AT18: =V18 -> 0 | AU18: =Z18 -> 0
A19: John Droog | B19: =LARGE(AP19:AU19,1) + LARGE(AP19:AU19,2) + LARGE(AP19:AU19,3) + LARGE(AP19:AU19,4) + LARGE(AP19:AU19,5) -> 10 | D19: 15 | E19: 25 | F19: 1 | L19: 15 | M19: 29 | N19: 1 | V19: 0 | X19: 15 | Y19: 36 | Z19: 8 | AP19: =F19 -> 1 | AQ19: =J19 -> 0 | AR19: =N19 -> 1 | AS19: =R19 -> 0 | AT19: =V19 -> 0 | AU19: =Z19 -> 8
A20: Joe Stack | B20: =LARGE(AP20:AU20,1) + LARGE(AP20:AU20,2) + LARGE(AP20:AU20,3) + LARGE(AP20:AU20,4) + LARGE(AP20:AU20,5) -> 10 | D20: 18 | E20: 29 | F20: 1 | V20: 0 | X20: 17 | Y20: 37 | Z20: 9 | AP20: =F20 -> 1 | AQ20: =J20 -> 0 | AR20: =N20 -> 0 | AS20: =R20 -> 0 | AT20: =V20 -> 0 | AU20: =Z20 -> 9
A21: Gerry O Donoghue | B21: =LARGE(AP21:AU21,1) + LARGE(AP21:AU21,2) + LARGE(AP21:AU21,3) + LARGE(AP21:AU21,4) + LARGE(AP21:AU21,5) -> 9 | D21: 23 | E21: 24 | F21: 1 | H21: 22 | I21: 18 | J21: 1 | L21: 23 | M21: 23 | N21: 1 | P21: 22 | Q21: 35 | R21: 6 | V21: 0 | AP21: =F21 -> 1 | AQ21: =J21 -> 1 | AR21: =N21 -> 1 | AS21: =R21 -> 6 | AT21: =V21 -> 0 | AU21: =Z21 -> 0
A22: Mary Lawton | B22: =LARGE(AP22:AU22,1) + LARGE(AP22:AU22,2) + LARGE(AP22:AU22,3) + LARGE(AP22:AU22,4) + LARGE(AP22:AU22,5) -> 8 | D22: 17 | E22: 22 | F22: 1 | H22: 17 | I22: 25 | J22: 5 | V22: 0 | X22: 18 | Y22: 33 | Z22: 2 | AP22: =F22 -> 1 | AQ22: =J22 -> 5 | AR22: =N22 -> 0 | AS22: =R22 -> 0 | AT22: =V22 -> 0 | AU22: =Z22 -> 2
A23: Mossie Duggan | B23: =LARGE(AP23:AU23,1) + LARGE(AP23:AU23,2) + LARGE(AP23:AU23,3) + LARGE(AP23:AU23,4) + LARGE(AP23:AU23,5) -> 8 | D23: 18 | E23: 30 | F23: 3 | L23: 18 | M23: 25 | N23: 1 | V23: 0 | X23: 18 | Y23: 33 | Z23: 4 | AP23: =F23 -> 3 | AQ23: =J23 -> 0 | AR23: =N23 -> 1 | AS23: =R23 -> 0 | AT23: =V23 -> 0 | AU23: =Z23 -> 4
A24: Bernard Lawton | B24: =LARGE(AP24:AU24,1) + LARGE(AP24:AU24,2) + LARGE(AP24:AU24,3) + LARGE(AP24:AU24,4) + LARGE(AP24:AU24,5) -> 7 | L24: 12 | M24: 34 | N24: 7 | V24: 0 | AP24: =F24 -> 0 | AQ24: =J24 -> 0 | AR24: =N24 -> 7 | AS24: =R24 -> 0 | AT24: =V24 -> 0 | AU24: =Z24 -> 0
A25: Chrsty O'Sullivan | B25: =LARGE(AP25:AU25,1) + LARGE(AP25:AU25,2) + LARGE(AP25:AU25,3) + LARGE(AP25:AU25,4) + LARGE(AP25:AU25,5) -> 5 | D25: 13 | E25: 27 | F25: 1 | H25: 13 | I25: 23 | J25: 3 | V25: 0 | Z25: 1 | AP25: =F25 -> 1 | AQ25: =J25 -> 3 | AR25: =N25 -> 0 | AS25: =R25 -> 0 | AT25: =V25 -> 0 | AU25: =Z25 -> 1
A26: Jim O'Rourke | B26: =LARGE(AP26:AU26,1) + LARGE(AP26:AU26,2) + LARGE(AP26:AU26,3) + LARGE(AP26:AU26,4) + LARGE(AP26:AU26,5) -> 5 | D26: 16 | E26: 24 | F26: 1 | L26: 16 | M26: 27 | N26: 1 | P26: 16 | Q26: 28 | R26: 2 | V26: 0 | Z26: 1 | AP26: =F26 -> 1 | AQ26: =J26 -> 0 | AR26: =N26 -> 1 | AS26: =R26 -> 2 | AT26: =V26 -> 0 | AU26: =Z26 -> 1
A27: Jim Morrison | B27: =LARGE(AP27:AU27,1) + LARGE(AP27:AU27,2) + LARGE(AP27:AU27,3) + LARGE(AP27:AU27,4) + LARGE(AP27:AU27,5) -> 4 | D27: 18 | E27: 31 | F27: 4 | V27: 0 | AP27: =F27 -> 4 | AQ27: =J27 -> 0 | AR27: =N27 -> 0 | AS27: =R27 -> 0 | AT27: =V27 -> 0 | AU27: =Z27 -> 0
A28: Johnny Moloney | B28: =LARGE(AP28:AU28,1) + LARGE(AP28:AU28,2) + LARGE(AP28:AU28,3) + LARGE(AP28:AU28,4) + LARGE(AP28:AU28,5) -> 3 | L28: 9 | M28: 30 | N28: 2 | V28: 0 | Z28: 1 | AP28: =F28 -> 0 | AQ28: =J28 -> 0 | AR28: =N28 -> 2 | AS28: =R28 -> 0 | AT28: =V28 -> 0 | AU28: =Z28 -> 1
A29: Liz Williams | B29: =LARGE(AP29:AU29,1) + LARGE(AP29:AU29,2) + LARGE(AP29:AU29,3) + LARGE(AP29:AU29,4) + LARGE(AP29:AU29,5) -> 2 | D29: 20 | E29: 26 | F29: 1 | H29: 20 | I29: 14 | J29: 1 | V29: 0 | AP29: =F29 -> 1 | AQ29: =J29 -> 1 | AR29: =N29 -> 0 | AS29: =R29 -> 0 | AT29: =V29 -> 0 | AU29: =Z29 -> 0
A30: Michael Walsh | B30: =LARGE(AP30:AU30,1) + LARGE(AP30:AU30,2) + LARGE(AP30:AU30,3) + LARGE(AP30:AU30,4) + LARGE(AP30:AU30,5) -> 2 | D30: 13 | E30: 25 | F30: 1 | V30: 0 | Z30: 1 | AP30: =F30 -> 1 | AQ30: =J30 -> 0 | AR30: =N30 -> 0 | AS30: =R30 -> 0 | AT30: =V30 -> 0 | AU30: =Z30 -> 1
A31: Johnny Morgan | B31: =LARGE(AP31:AU31,1) + LARGE(AP31:AU31,2) + LARGE(AP31:AU31,3) + LARGE(AP31:AU31,4) + LARGE(AP31:AU31,5) -> 2 | H31: 18 | I31: 20 | J31: 1 | V31: 0 | Z31: 1 | AP31: =F31 -> 0 | AQ31: =J31 -> 1 | AR31: =N31 -> 0 | AS31: =R31 -> 0 | AT31: =V31 -> 0 | AU31: =Z31 -> 1
A32: Ted Golden | B32: =LARGE(AP32:AU32,1) + LARGE(AP32:AU32,2) + LARGE(AP32:AU32,3) + LARGE(AP32:AU32,4) + LARGE(AP32:AU32,5) -> 2 | P32: 18 | Q32: 23 | R32: 1 | V32: 0 | Z32: 1 | AP32: =F32 -> 0 | AQ32: =J32 -> 0 | AR32: =N32 -> 0 | AS32: =R32 -> 1 | AT32: =V32 -> 0 | AU32: =Z32 -> 1
A33: Ultan Murphy | B33: =LARGE(AP33:AU33,1) + LARGE(AP33:AU33,2) + LARGE(AP33:AU33,3) + LARGE(AP33:AU33,4) + LARGE(AP33:AU33,5) -> 1 | V33: 0 | Z33: 1 | AP33: =F33 -> 0 | AQ33: =J33 -> 0 | AR33: =N33 -> 0 | AS33: =R33 -> 0 | AT33: =V33 -> 0 | AU33: =Z33 -> 1
A34: Dan Buckley | B34: =LARGE(AP34:AU34,1) + LARGE(AP34:AU34,2) + LARGE(AP34:AU34,3) + LARGE(AP34:AU34,4) + LARGE(AP34:AU34,5) -> 1 | V34: 0 | Z34: 1 | AP34: =F34 -> 0 | AQ34: =J34 -> 0 | AR34: =N34 -> 0 | AS34: =R34 -> 0 | AT34: =V34 -> 0 | AU34: =Z34 -> 1
A35: Billy Steele | B35: =LARGE(AP35:AU35,1) + LARGE(AP35:AU35,2) + LARGE(AP35:AU35,3) + LARGE(AP35:AU35,4) + LARGE(AP35:AU35,5) -> 1 | V35: 0 | Z35: 1 | AP35: =F35 -> 0 | AQ35: =J35 -> 0 | AR35: =N35 -> 0 | AS35: =R35 -> 0 | AT35: =V35 -> 0 | AU35: =Z35 -> 1
A36: Vincent O'Brien | B36: =LARGE(AP36:AU36,1) + LARGE(AP36:AU36,2) + LARGE(AP36:AU36,3) + LARGE(AP36:AU36,4) + LARGE(AP36:AU36,5) -> 0 | V36: 0 | AP36: =F36 -> 0 | AQ36: =J36 -> 0 | AR36: =N36 -> 0 | AS36: =R36 -> 0 | AT36: =V36 -> 0 | AU36: =Z36 -> 0
A37: Killian McGrath | B37: =LARGE(AP37:AU37,1) + LARGE(AP37:AU37,2) + LARGE(AP37:AU37,3) + LARGE(AP37:AU37,4) + LARGE(AP37:AU37,5) -> 0 | V37: 0 | AP37: =F37 -> 0 | AQ37: =J37 -> 0 | AR37: =N37 -> 0 | AS37: =R37 -> 0 | AT37: =V37 -> 0 | AU37: =Z37 -> 0
A38: Eamon McSweeney | B38: =LARGE(AP38:AU38,1) + LARGE(AP38:AU38,2) + LARGE(AP38:AU38,3) + LARGE(AP38:AU38,4) + LARGE(AP38:AU38,5) -> 0 | V38: 0 | AP38: =F38 -> 0 | AQ38: =J38 -> 0 | AR38: =N38 -> 0 | AS38: =R38 -> 0 | AT38: =V38 -> 0 | AU38: =Z38 -> 0
V39: 0 | AP39: =F39 -> 0 | AQ39: =J39 -> 0 | AR39: =N39 -> 0 | AS39: =R39 -> 0 | AT39: =V39 -> 0 | AU39: =Z39 -> 0
V40: 0 | AP40: =F40 -> 0 | AQ40: =J40 -> 0 | AR40: =N40 -> 0 | AS40: =R40 -> 0 | AT40: =V40 -> 0 | AU40: =Z40 -> 0
AP41: =F41 -> 0 | AQ41: =J41 -> 0 | AR41: =N41 -> 0 | AS41: =R41 -> 0 | AT41: =V41 -> 0 | AU41: =Z41 -> 0
AP42: =F42 -> 0 | AQ42: =J42 -> 0 | AR42: =N42 -> 0 | AS42: =R42 -> 0 | AT42: =V42 -> 0 | AU42: =Z42 -> 0
AP43: =F43 -> 0 | AQ43: =J43 -> 0 | AR43: =N43 -> 0 | AS43: =R43 -> 0 | AT43: =V43 -> 0 | AU43: =Z43 -> 0
AP44: =F44 -> 0 | AQ44: =J44 -> 0 | AR44: =N44 -> 0 | AS44: =R44 -> 0 | AT44: =V44 -> 0 | AU44: =Z44 -> 0
AP45: =F45 -> 0 | AQ45: =J45 -> 0 | AR45: =N45 -> 0 | AS45: =R45 -> 0 | AT45: =V45 -> 0 | AU45: =Z45 -> 0
AP46: =F46 -> 0 | AQ46: =J46 -> 0 | AR46: =N46 -> 0 | AS46: =R46 -> 0 | AT46: =V46 -> 0 | AU46: =Z46 -> 0
AP47: =F47 -> 0 | AQ47: =J47 -> 0 | AR47: =N47 -> 0 | AS47: =R47 -> 0 | AT47: =V47 -> 0 | AU47: =Z47 -> 0
AP48: =F48 -> 0 | AQ48: =J48 -> 0 | AR48: =N48 -> 0 | AS48: =R48 -> 0 | AT48: =V48 -> 0 | AU48: =Z48 -> 0
AP49: =F49 -> 0 | AQ49: =J49 -> 0 | AR49: =N49 -> 0 | AS49: =R49 -> 0 | AT49: =V49 -> 0 | AU49: =Z49 -> 0
AP50: =F50 -> 0 | AQ50: =J50 -> 0 | AR50: =N50 -> 0 | AS50: =R50 -> 0 | AT50: =V50 -> 0 | AU50: =Z50 -> 0
AP51: =F51 -> 0 | AQ51: =J51 -> 0 | AR51: =N51 -> 0 | AS51: =R51 -> 0 | AT51: =V51 -> 0 | AU51: =Z51 -> 0
AP52: =F52 -> 0 | AQ52: =J52 -> 0 | AR52: =N52 -> 0 | AS52: =R52 -> 0 | AT52: =V52 -> 0 | AU52: =Z52 -> 0
AP53: =F53 -> 0 | AQ53: =J53 -> 0 | AR53: =N53 -> 0 | AS53: =R53 -> 0 | AT53: =V53 -> 0 | AU53: =Z53 -> 0
AP54: =F54 -> 0 | AQ54: =J54 -> 0 | AR54: =N54 -> 0 | AS54: =R54 -> 0 | AT54: =V54 -> 0 | AU54: =Z54 -> 0
AP55: =F55 -> 0 | AQ55: =J55 -> 0 | AR55: =N55 -> 0 | AS55: =R55 -> 0 | AT55: =V55 -> 0 | AU55: =Z55 -> 0
AP56: =F56 -> 0 | AQ56: =J56 -> 0 | AR56: =N56 -> 0 | AS56: =R56 -> 0 | AT56: =V56 -> 0 | AU56: =Z56 -> 0
AP57: =F57 -> 0 | AQ57: =J57 -> 0 | AR57: =N57 -> 0 | AS57: =R57 -> 0 | AT57: =V57 -> 0 | AU57: =Z57 -> 0
AP58: =F58 -> 0 | AQ58: =J58 -> 0 | AR58: =N58 -> 0 | AS58: =R58 -> 0 | AT58: =V58 -> 0 | AU58: =Z58 -> 0
AP59: =F59 -> 0 | AQ59: =J59 -> 0 | AR59: =N59 -> 0 | AS59: =R59 -> 0 | AT59: =V59 -> 0 | AU59: =Z59 -> 0
AP60: =F60 -> 0 | AQ60: =J60 -> 0 | AR60: =N60 -> 0 | AS60: =R60 -> 0 | AT60: =V60 -> 0 | AU60: =Z60 -> 0
AP61: =F61 -> 0 | AQ61: =J61 -> 0 | AR61: =N61 -> 0 | AS61: =R61 -> 0 | AT61: =V61 -> 0 | AU61: =Z61 -> 0
AP62: =F62 -> 0 | AQ62: =J62 -> 0 | AR62: =N62 -> 0 | AS62: =R62 -> 0 | AT62: =V62 -> 0 | AU62: =Z62 -> 0
AP63: =F63 -> 0 | AQ63: =J63 -> 0 | AR63: =N63 -> 0 | AS63: =R63 -> 0 | AT63: =V63 -> 0 | AU63: =Z63 -> 0
AP64: =F64 -> 0 | AQ64: =J64 -> 0 | AR64: =N64 -> 0 | AS64: =R64 -> 0 | AT64: =V64 -> 0 | AU64: =Z64 -> 0
AP65: =F65 -> 0 | AQ65: =J65 -> 0 | AR65: =N65 -> 0 | AS65: =R65 -> 0 | AT65: =V65 -> 0 | AU65: =Z65 -> 0
AP66: =F66 -> 0 | AQ66: =J66 -> 0 | AR66: =N66 -> 0 | AS66: =R66 -> 0 | AT66: =V66 -> 0 | AU66: =Z66 -> 0
AP67: =F67 -> 0 | AQ67: =J67 -> 0 | AR67: =N67 -> 0 | AS67: =R67 -> 0 | AT67: =V67 -> 0 | AU67: =Z67 -> 0
AP68: =F68 -> 0 | AQ68: =J68 -> 0 | AR68: =N68 -> 0 | AS68: =R68 -> 0 | AT68: =V68 -> 0 | AU68: =Z68 -> 0
AP69: =F69 -> 0 | AQ69: =J69 -> 0 | AR69: =N69 -> 0 | AS69: =R69 -> 0 | AT69: =V69 -> 0 | AU69: =Z69 -> 0
AP70: =F70 -> 0 | AQ70: =J70 -> 0 | AR70: =N70 -> 0 | AS70: =R70 -> 0 | AT70: =V70 -> 0 | AU70: =Z70 -> 0
AP71: =F71 -> 0 | AQ71: =J71 -> 0 | AR71: =N71 -> 0 | AS71: =R71 -> 0 | AT71: =V71 -> 0 | AU71: =Z71 -> 0
AP72: =F72 -> 0 | AQ72: =J72 -> 0 | AR72: =N72 -> 0 | AS72: =R72 -> 0 | AT72: =V72 -> 0 | AU72: =Z72 -> 0
AP73: =F73 -> 0 | AQ73: =J73 -> 0 | AR73: =N73 -> 0 | AS73: =R73 -> 0 | AT73: =V73 -> 0 | AU73: =Z73 -> 0
AP74: =F74 -> 0 | AQ74: =J74 -> 0 | AR74: =N74 -> 0 | AS74: =R74 -> 0 | AT74: =V74 -> 0 | AU74: =Z74 -> 0
AP75: =F75 -> 0 | AQ75: =J75 -> 0 | AR75: =N75 -> 0 | AS75: =R75 -> 0 | AT75: =V75 -> 0 | AU75: =Z75 -> 0
AP76: =F76 -> 0 | AQ76: =J76 -> 0 | AR76: =N76 -> 0 | AS76: =R76 -> 0 | AT76: =V76 -> 0 | AU76: =Z76 -> 0
AP77: =F77 -> 0 | AQ77: =J77 -> 0 | AR77: =N77 -> 0 | AS77: =R77 -> 0 | AT77: =V77 -> 0 | AU77: =Z77 -> 0
AP78: =F78 -> 0 | AQ78: =J78 -> 0 | AR78: =N78 -> 0 | AS78: =R78 -> 0 | AT78: =V78 -> 0 | AU78: =Z78 -> 0
AP79: =F79 -> 0 | AQ79: =J79 -> 0 | AR79: =N79 -> 0 | AS79: =R79 -> 0 | AT79: =V79 -> 0 | AU79: =Z79 -> 0
AP80: =F80 -> 0 | AQ80: =J80 -> 0 | AR80: =N80 -> 0 | AS80: =R80 -> 0 | AT80: =V80 -> 0 | AU80: =Z80 -> 0
AP81: =F81 -> 0 | AQ81: =J81 -> 0 | AR81: =N81 -> 0 | AS81: =R81 -> 0 | AT81: =V81 -> 0 | AU81: =Z81 -> 0
AP82: =F82 -> 0 | AQ82: =J82 -> 0 | AR82: =N82 -> 0 | AS82: =R82 -> 0 | AT82: =V82 -> 0 | AU82: =Z82 -> 0
AP83: =F83 -> 0 | AQ83: =J83 -> 0 | AR83: =N83 -> 0 | AS83: =R83 -> 0 | AT83: =V83 -> 0 | AU83: =Z83 -> 0
AP84: =F84 -> 0 | AQ84: =J84 -> 0 | AR84: =N84 -> 0 | AS84: =R84 -> 0 | AT84: =V84 -> 0 | AU84: =Z84 -> 0
AP85: =F87 -> 0 | AQ85: =J87 -> 0 | AR85: =N87 -> 0 | AS85: =R87 -> 0 | AT85: =V87 -> 0 | AU85: =Z87 -> 0
AP86: =F88 -> 0 | AQ86: =J88 -> 0 | AR86: =N88 -> 0 | AS86: =R88 -> 0 | AT86: =V88 -> 0 | AU86: =Z88 -> 0
AP87: =F89 -> 0 | AQ87: =J89 -> 0 | AR87: =N89 -> 0 | AS87: =R89 -> 0 | AT87: =V89 -> 0 | AU87: =Z89 -> 0
AP88: =F90 -> 0 | AQ88: =J90 -> 0 | AR88: =N90 -> 0 | AS88: =R90 -> 0 | AT88: =V90 -> 0 | AU88: =Z90 -> 0
AP89: =F91 -> 0 | AQ89: =J91 -> 0 | AR89: =N91 -> 0 | AS89: =R91 -> 0 | AT89: =V91 -> 0 | AU89: =Z91 -> 0
AP90: =F92 -> 0 | AQ90: =J92 -> 0 | AR90: =N92 -> 0 | AS90: =R92 -> 0 | AT90: =V92 -> 0 | AU90: =Z92 -> 0
AP91: =F93 -> 0 | AQ91: =J93 -> 0 | AR91: =N93 -> 0 | AS91: =R93 -> 0 | AT91: =V93 -> 0 | AU91: =Z93 -> 0
AP92: =F94 -> 0 | AQ92: =J94 -> 0 | AR92: =N94 -> 0 | AS92: =R94 -> 0 | AT92: =V94 -> 0 | AU92: =Z94 -> 0
AP93: =F95 -> 0 | AQ93: =J95 -> 0 | AR93: =N95 -> 0 | AS93: =R95 -> 0 | AT93: =V95 -> 0 | AU93: =Z95 -> 0
AP94: =F96 -> 0 | AQ94: =J96 -> 0 | AR94: =N96 -> 0 | AS94: =R96 -> 0 | AT94: =V96 -> 0 | AU94: =Z96 -> 0
AP95: =F97 -> 0 | AQ95: =J97 -> 0 | AR95: =N97 -> 0 | AS95: =R97 -> 0 | AT95: =V97 -> 0 | AU95: =Z97 -> 0
AP96: =F98 -> 0 | AQ96: =J98 -> 0 | AR96: =N98 -> 0 | AS96: =R98 -> 0 | AT96: =V98 -> 0 | AU96: =Z98 -> 0
AP97: =F99 -> 0 | AQ97: =J99 -> 0 | AR97: =N99 -> 0 | AS97: =R99 -> 0 | AT97: =V99 -> 0 | AU97: =Z99 -> 0
AP98: =F100 -> 0 | AQ98: =J100 -> 0 | AR98: =N100 -> 0 | AS98: =R100 -> 0 | AT98: =V100 -> 0 | AU98: =Z100 -> 0