A1: Castlemartyr GAA Golf Society
A2: 2009 Golfer of the Year Table [best 4 goy pts to count]
A3: 10pts awarded to winner, 9pts to runner up, 8, 7, 6…….1
A4: * Prize-winners are deducted points from their total score for future outings - 1st -2pts, 2nd -1pt, 3rd -.5
A5: Adjustments will be discounted for the Captains Prize. For GOY purposes your score before adjustments will be taken.
F7: Castlemartyr - 28/02/09 | J7: Fota - 18/04/00 | N7: Waterrock - 26/06/09 | R7: Youghal - 12/09/09 | V7: Adare Manor - 13/10/09
B8: Total | C8: Handicap | D8: Score Adj* | F8: hcap | G8: score | H8: goy pts | J8: hcap | K8: score | L8: goy pts | N8: hcap | O8: score | P8: goy pts | R8: hcap | S8: score | T8: goy pts | V8: hcap | W8: score | X8: goy pts
A9: Fergus Lynch | B9: =LARGE(AO9:AS9,1) + LARGE(AO9:AS9,2) + LARGE(AO9:AS9,3) + LARGE(AO9:AS9,4) -> 25 | C9: GUI | D9: -2 | F9: 19 | G9: 33 | H9: 1 | J9: 19 | K9: 33 | L9: 10 | N9: 19 | O9: 37 | P9: 9 | R9: 19 | S9: 31 | T9: 5 | AO9: =H9 -> 1 | AP9: =L9 -> 10 | AQ9: =P9 -> 9 | AR9: =T9 -> 5 | AS9: =X9 -> 0
A10: John Roche | B10: =LARGE(AO10:AS10,1) + LARGE(AO10:AS10,2) + LARGE(AO10:AS10,3) + LARGE(AO10:AS10,4) -> 22 | C10: GUI | D10: -2.5 | F10: 17 | G10: 30 | H10: 1 | J10: 17 | K10: 28 | L10: 3 | N10: 17 | O10: 39 | P10: 10 | R10: 17 | S10: 34 | T10: 8 | AO10: =H10 -> 1 | AP10: =L10 -> 3 | AQ10: =P10 -> 10 | AR10: =T10 -> 8 | AS10: =X10 -> 0
A11: Martina O'Halloran | B11: =LARGE(AO11:AS11,1) + LARGE(AO11:AS11,2) + LARGE(AO11:AS11,3) + LARGE(AO11:AS11,4) -> 21 | C11: GUI | D11: -1 | F11: 20 | G11: 30 | H11: 1 | J11: 20 | K11: 32 | L11: 9 | N11: 20 | O11: 29 | P11: 4 | R11: 21 | S11: 33 | T11: 7 | AO11: =H11 -> 1 | AP11: =L11 -> 9 | AQ11: =P11 -> 4 | AR11: =T11 -> 7 | AS11: =X11 -> 0
A12: Bill Summers | B12: =LARGE(AO12:AS12,1) + LARGE(AO12:AS12,2) + LARGE(AO12:AS12,3) + LARGE(AO12:AS12,4) -> 19 | C12: GUI | D12: -2 | F12: 22 | G12: 42 | H12: 10 | J12: 22 | K12: 26 | L12: 1 | N12: 20 | O12: 37 | P12: 8 | AO12: =H12 -> 10 | AP12: =L12 -> 1 | AQ12: =P12 -> 8 | AR12: =T12 -> 0 | AS12: =X12 -> 0
A13: Damien Roche | B13: =LARGE(AO13:AS13,1) + LARGE(AO13:AS13,2) + LARGE(AO13:AS13,3) + LARGE(AO13:AS13,4) -> 19 | C13: GUI | D13: -2 | F13: 14 | G13: 39 | H13: 9 | J13: 14 | K13: 23 | L13: 1 | R13: 14 | S13: 34 | T13: 9 | AO13: =H13 -> 9 | AP13: =L13 -> 1 | AQ13: =P13 -> 0 | AR13: =T13 -> 9 | AS13: =X13 -> 0
A14: Micháel Wash | B14: =LARGE(AO14:AS14,1) + LARGE(AO14:AS14,2) + LARGE(AO14:AS14,3) + LARGE(AO14:AS14,4) -> 15 | C14: GUI | D14: -0.5 | F14: 13 | G14: 37 | H14: 8 | J14: 13 | K14: 29 | L14: 7 | AO14: =H14 -> 8 | AP14: =L14 -> 7 | AQ14: =P14 -> 0 | AR14: =T14 -> 0 | AS14: =X14 -> 0
A15: Christy Osullivan | B15: =LARGE(AO15:AS15,1) + LARGE(AO15:AS15,2) + LARGE(AO15:AS15,3) + LARGE(AO15:AS15,4) -> 13 | C15: GUI | D15: 0 | F15: 13 | G15: 37 | H15: 7 | R15: 15 | S15: 32 | T15: 6 | AO15: =H15 -> 7 | AP15: =L15 -> 0 | AQ15: =P15 -> 0 | AR15: =T15 -> 6 | AS15: =X15 -> 0
A16: Cha O'Neill | B16: =LARGE(AO16:AS16,1) + LARGE(AO16:AS16,2) + LARGE(AO16:AS16,3) + LARGE(AO16:AS16,4) -> 12 | C16: GUI | D16: -2 | F16: 20 | G16: 30 | H16: 1 | J16: 20 | K16: 22 | L16: 1 | R16: 20 | S16: 35 | T16: 10 | AO16: =H16 -> 1 | AP16: =L16 -> 1 | AQ16: =P16 -> 0 | AR16: =T16 -> 10 | AS16: =X16 -> 0
A17: Conor Roche | B17: =LARGE(AO17:AS17,1) + LARGE(AO17:AS17,2) + LARGE(AO17:AS17,3) + LARGE(AO17:AS17,4) -> 11 | C17: GUI | D17: 0 | F17: 16 | G17: 33 | H17: 2 | J17: 16 | K17: 29 | L17: 5 | R17: 16 | S17: 29 | T17: 4 | AO17: =H17 -> 2 | AP17: =L17 -> 5 | AQ17: =P17 -> 0 | AR17: =T17 -> 4 | AS17: =X17 -> 0
A18: Carey Joyce | B18: =LARGE(AO18:AS18,1) + LARGE(AO18:AS18,2) + LARGE(AO18:AS18,3) + LARGE(AO18:AS18,4) -> 9 | C18: 20 | D18: -1 | J18: 20 | K18: 28 | L18: 2 | N18: 20 | O18: 36 | P18: 7 | AO18: =H18 -> 0 | AP18: =L18 -> 2 | AQ18: =P18 -> 7 | AR18: =T18 -> 0 | AS18: =X18 -> 0
A19: Joe Stack | B19: =LARGE(AO19:AS19,1) + LARGE(AO19:AS19,2) + LARGE(AO19:AS19,3) + LARGE(AO19:AS19,4) -> 8 | C19: 16 | D19: -0.5 | J19: 16 | K19: 31 | L19: 8 | AO19: =H19 -> 0 | AP19: =L19 -> 8 | AQ19: =P19 -> 0 | AR19: =T19 -> 0 | AS19: =X19 -> 0
A20: Richard Aherne | B20: =LARGE(AO20:AS20,1) + LARGE(AO20:AS20,2) + LARGE(AO20:AS20,3) + LARGE(AO20:AS20,4) -> 7 | C20: GUI | D20: -0.5 | F20: 12 | G20: 28 | H20: 1 | J20: 12 | K20: 25 | L20: 1 | N20: 12 | O20: 35 | P20: 5 | AO20: =H20 -> 1 | AP20: =L20 -> 1 | AQ20: =P20 -> 5 | AR20: =T20 -> 0 | AS20: =X20 -> 0
A21: Joe Griffin | B21: =LARGE(AO21:AS21,1) + LARGE(AO21:AS21,2) + LARGE(AO21:AS21,3) + LARGE(AO21:AS21,4) -> 7 | C21: 20 | D21: 0 | F21: 18 | G21: 21 | H21: 1 | N21: 18 | O21: 36 | P21: 6 | AO21: =H21 -> 1 | AP21: =L21 -> 0 | AQ21: =P21 -> 6 | AR21: =T21 -> 0 | AS21: =X21 -> 0
A22: John Moloney | B22: =LARGE(AO22:AS22,1) + LARGE(AO22:AS22,2) + LARGE(AO22:AS22,3) + LARGE(AO22:AS22,4) -> 6 | C22: GUI | D22: 0 | F22: 9 | G22: 36 | H22: 6 | AO22: =H22 -> 6 | AP22: =L22 -> 0 | AQ22: =P22 -> 0 | AR22: =T22 -> 0 | AS22: =X22 -> 0
A23: Ultan Murphy | B23: =LARGE(AO23:AS23,1) + LARGE(AO23:AS23,2) + LARGE(AO23:AS23,3) + LARGE(AO23:AS23,4) -> 6 | C23: 16 | D23: 0 | J23: 16 | K23: 29 | L23: 6 | AO23: =H23 -> 0 | AP23: =L23 -> 6 | AQ23: =P23 -> 0 | AR23: =T23 -> 0 | AS23: =X23 -> 0
A24: Mary Lawton | B24: =LARGE(AO24:AS24,1) + LARGE(AO24:AS24,2) + LARGE(AO24:AS24,3) + LARGE(AO24:AS24,4) -> 6 | C24: GUI | D24: 0 | F24: 18 | G24: 34 | H24: 3 | R24: 18 | S24: 27 | T24: 3 | AO24: =H24 -> 3 | AP24: =L24 -> 0 | AQ24: =P24 -> 0 | AR24: =T24 -> 3 | AS24: =X24 -> 0
A25: Liz Williams | B25: =LARGE(AO25:AS25,1) + LARGE(AO25:AS25,2) + LARGE(AO25:AS25,3) + LARGE(AO25:AS25,4) -> 5 | C25: GUI | D25: 0 | F25: 20 | G25: 36 | H25: 5 | AO25: =H25 -> 5 | AP25: =L25 -> 0 | AQ25: =P25 -> 0 | AR25: =T25 -> 0 | AS25: =X25 -> 0
A26: Jim O'Rourke | B26: =LARGE(AO26:AS26,1) + LARGE(AO26:AS26,2) + LARGE(AO26:AS26,3) + LARGE(AO26:AS26,4) -> 5 | C26: GUI | D26: 0 | F26: 16 | G26: 31 | H26: 1 | J26: 16 | K26: 25 | L26: 1 | N26: 16 | O26: 26 | P26: 3 | AO26: =H26 -> 1 | AP26: =L26 -> 1 | AQ26: =P26 -> 3 | AR26: =T26 -> 0 | AS26: =X26 -> 0
A27: Moss Duggan | B27: =LARGE(AO27:AS27,1) + LARGE(AO27:AS27,2) + LARGE(AO27:AS27,3) + LARGE(AO27:AS27,4) -> 4 | C27: 18 | D27: 0 | F27: 18 | G27: 34 | H27: 4 | AO27: =H27 -> 4 | AP27: =L27 -> 0 | AQ27: =P27 -> 0 | AR27: =T27 -> 0 | AS27: =X27 -> 0
A28: John Droog | B28: =LARGE(AO28:AS28,1) + LARGE(AO28:AS28,2) + LARGE(AO28:AS28,3) + LARGE(AO28:AS28,4) -> 4 | C28: GUI | D28: 0 | J28: 15 | K28: 29 | L28: 4 | AO28: =H28 -> 0 | AP28: =L28 -> 4 | AQ28: =P28 -> 0 | AR28: =T28 -> 0 | AS28: =X28 -> 0
A29: Michel Cowhig | B29: =LARGE(AO29:AS29,1) + LARGE(AO29:AS29,2) + LARGE(AO29:AS29,3) + LARGE(AO29:AS29,4) -> 3 | C29: 24 | D29: 0 | H29: 1 | N29: 24 | P29: 1 | R29: 24 | T29: 1 | AO29: =H29 -> 1 | AP29: =L29 -> 0 | AQ29: =P29 -> 1 | AR29: =T29 -> 1 | AS29: =X29 -> 0
A30: Bernard Lawton | B30: =LARGE(AO30:AS30,1) + LARGE(AO30:AS30,2) + LARGE(AO30:AS30,3) + LARGE(AO30:AS30,4) -> 2 | C30: GUI | D30: 0 | F30: 12 | G30: 33 | H30: 1 | J30: 12 | K30: 28 | L30: 1 | AO30: =H30 -> 1 | AP30: =L30 -> 1 | AQ30: =P30 -> 0 | AR30: =T30 -> 0 | AS30: =X30 -> 0
A31: Ted Golden | B31: =LARGE(AO31:AS31,1) + LARGE(AO31:AS31,2) + LARGE(AO31:AS31,3) + LARGE(AO31:AS31,4) -> 2 | C31: 21 | D31: 0 | F31: 20 | G31: 8 | H31: 1 | N31: 20 | P31: 1 | AO31: =H31 -> 1 | AP31: =L31 -> 0 | AQ31: =P31 -> 1 | AR31: =T31 -> 0 | AS31: =X31 -> 0
A32: Vivan Macakessy | B32: =LARGE(AO32:AS32,1) + LARGE(AO32:AS32,2) + LARGE(AO32:AS32,3) + LARGE(AO32:AS32,4) -> 2 | C32: GUI | N32: 18 | O32: 24 | P32: 2 | AO32: =H32 -> 0 | AP32: =L32 -> 0 | AQ32: =P32 -> 2 | AR32: =T32 -> 0 | AS32: =X32 -> 0
A33: Jim Brickley | B33: =LARGE(AO33:AS33,1) + LARGE(AO33:AS33,2) + LARGE(AO33:AS33,3) + LARGE(AO33:AS33,4) -> 1 | C33: GUI | D33: 0 | F33: 14 | G33: 27 | H33: 1 | AO33: =H33 -> 1 | AP33: =L33 -> 0 | AQ33: =P33 -> 0 | AR33: =T33 -> 0 | AS33: =X33 -> 0
A34: Michael Carroll | B34: =LARGE(AO34:AS34,1) + LARGE(AO34:AS34,2) + LARGE(AO34:AS34,3) + LARGE(AO34:AS34,4) -> 1 | C34: GUI | D34: 0 | F34: 22 | G34: 24 | H34: 1 | AO34: =H34 -> 1 | AP34: =L34 -> 0 | AQ34: =P34 -> 0 | AR34: =T34 -> 0 | AS34: =X34 -> 0
A35: Eamon Roche | B35: =LARGE(AO35:AS35,1) + LARGE(AO35:AS35,2) + LARGE(AO35:AS35,3) + LARGE(AO35:AS35,4) -> 1 | C35: GUI | D35: 0 | J35: 11 | K35: 28 | L35: 1 | AO35: =H35 -> 0 | AP35: =L35 -> 1 | AQ35: =P35 -> 0 | AR35: =T35 -> 0 | AS35: =X35 -> 0
A36: Vincent O'Brien | B36: =LARGE(AO36:AS36,1) + LARGE(AO36:AS36,2) + LARGE(AO36:AS36,3) + LARGE(AO36:AS36,4) -> 1 | C36: GUI | D36: 0 | J36: 18 | K36: 25 | L36: 1 | AO36: =H36 -> 0 | AP36: =L36 -> 1 | AQ36: =P36 -> 0 | AR36: =T36 -> 0 | AS36: =X36 -> 0
B37: =LARGE(AO37:AS37,1) + LARGE(AO37:AS37,2) + LARGE(AO37:AS37,3) + LARGE(AO37:AS37,4) -> 0 | AO37: =H37 -> 0 | AP37: =L37 -> 0 | AQ37: =P37 -> 0 | AR37: =T37 -> 0 | AS37: =X37 -> 0
B38: =LARGE(AO38:AS38,1) + LARGE(AO38:AS38,2) + LARGE(AO38:AS38,3) + LARGE(AO38:AS38,4) -> 0 | AO38: =H38 -> 0 | AP38: =L38 -> 0 | AQ38: =P38 -> 0 | AR38: =T38 -> 0 | AS38: =X38 -> 0
B39: =LARGE(AO39:AS39,1) + LARGE(AO39:AS39,2) + LARGE(AO39:AS39,3) + LARGE(AO39:AS39,4) -> 0 | AO39: =H39 -> 0 | AP39: =L39 -> 0 | AQ39: =P39 -> 0 | AR39: =T39 -> 0 | AS39: =X39 -> 0
B40: =LARGE(AO40:AS40,1) + LARGE(AO40:AS40,2) + LARGE(AO40:AS40,3) + LARGE(AO40:AS40,4) -> 0 | AO40: =H40 -> 0 | AP40: =L40 -> 0 | AQ40: =P40 -> 0 | AR40: =T40 -> 0 | AS40: =X40 -> 0
B41: =LARGE(AO41:AS41,1) + LARGE(AO41:AS41,2) + LARGE(AO41:AS41,3) + LARGE(AO41:AS41,4) -> 0 | AO41: =H41 -> 0 | AP41: =L41 -> 0 | AQ41: =P41 -> 0 | AR41: =T41 -> 0 | AS41: =X41 -> 0
B42: =LARGE(AO42:AS42,1) + LARGE(AO42:AS42,2) + LARGE(AO42:AS42,3) + LARGE(AO42:AS42,4) -> 0 | AO42: =H42 -> 0 | AP42: =L42 -> 0 | AQ42: =P42 -> 0 | AR42: =T42 -> 0 | AS42: =X42 -> 0
B43: =LARGE(AO43:AS43,1) + LARGE(AO43:AS43,2) + LARGE(AO43:AS43,3) + LARGE(AO43:AS43,4) -> 0 | AO43: =H43 -> 0 | AP43: =L43 -> 0 | AQ43: =P43 -> 0 | AR43: =T43 -> 0 | AS43: =X43 -> 0
AO44: =H44 -> 0 | AP44: =L44 -> 0 | AQ44: =P44 -> 0 | AR44: =T44 -> 0 | AS44: =X44 -> 0
AO45: =H45 -> 0 | AP45: =L45 -> 0 | AQ45: =P45 -> 0 | AR45: =T45 -> 0 | AS45: =X45 -> 0
AO46: =H46 -> 0 | AP46: =L46 -> 0 | AQ46: =P46 -> 0 | AR46: =T46 -> 0 | AS46: =X46 -> 0
AO47: =H47 -> 0 | AP47: =L47 -> 0 | AQ47: =P47 -> 0 | AR47: =T47 -> 0 | AS47: =X47 -> 0
AO48: =H48 -> 0 | AP48: =L48 -> 0 | AQ48: =P48 -> 0 | AR48: =T48 -> 0 | AS48: =X48 -> 0
AO49: =H49 -> 0 | AP49: =L49 -> 0 | AQ49: =P49 -> 0 | AR49: =T49 -> 0 | AS49: =X49 -> 0
AO50: =H50 -> 0 | AP50: =L50 -> 0 | AQ50: =P50 -> 0 | AR50: =T50 -> 0 | AS50: =X50 -> 0
AO51: =H51 -> 0 | AP51: =L51 -> 0 | AQ51: =P51 -> 0 | AR51: =T51 -> 0 | AS51: =X51 -> 0
AO52: =H52 -> 0 | AP52: =L52 -> 0 | AQ52: =P52 -> 0 | AR52: =T52 -> 0 | AS52: =X52 -> 0
AO53: =H53 -> 0 | AP53: =L53 -> 0 | AQ53: =P53 -> 0 | AR53: =T53 -> 0 | AS53: =X53 -> 0
AO54: =H54 -> 0 | AP54: =L54 -> 0 | AQ54: =P54 -> 0 | AR54: =T54 -> 0 | AS54: =X54 -> 0
AO55: =H55 -> 0 | AP55: =L55 -> 0 | AQ55: =P55 -> 0 | AR55: =T55 -> 0 | AS55: =X55 -> 0
AO56: =H56 -> 0 | AP56: =L56 -> 0 | AQ56: =P56 -> 0 | AR56: =T56 -> 0 | AS56: =X56 -> 0
AO57: =H57 -> 0 | AP57: =L57 -> 0 | AQ57: =P57 -> 0 | AR57: =T57 -> 0 | AS57: =X57 -> 0
AO58: =H58 -> 0 | AP58: =L58 -> 0 | AQ58: =P58 -> 0 | AR58: =T58 -> 0 | AS58: =X58 -> 0
AO59: =H59 -> 0 | AP59: =L59 -> 0 | AQ59: =P59 -> 0 | AR59: =T59 -> 0 | AS59: =X59 -> 0
AO60: =H60 -> 0 | AP60: =L60 -> 0 | AQ60: =P60 -> 0 | AR60: =T60 -> 0 | AS60: =X60 -> 0
AO61: =H61 -> 0 | AP61: =L61 -> 0 | AQ61: =P61 -> 0 | AR61: =T61 -> 0 | AS61: =X61 -> 0
AO62: =H62 -> 0 | AP62: =L62 -> 0 | AQ62: =P62 -> 0 | AR62: =T62 -> 0 | AS62: =X62 -> 0
AO63: =H63 -> 0 | AP63: =L63 -> 0 | AQ63: =P63 -> 0 | AR63: =T63 -> 0 | AS63: =X63 -> 0
AO64: =H64 -> 0 | AP64: =L64 -> 0 | AQ64: =P64 -> 0 | AR64: =T64 -> 0 | AS64: =X64 -> 0
AO65: =H65 -> 0 | AP65: =L65 -> 0 | AQ65: =P65 -> 0 | AR65: =T65 -> 0 | AS65: =X65 -> 0
AO66: =H66 -> 0 | AP66: =L66 -> 0 | AQ66: =P66 -> 0 | AR66: =T66 -> 0 | AS66: =X66 -> 0
AO67: =H67 -> 0 | AP67: =L67 -> 0 | AQ67: =P67 -> 0 | AR67: =T67 -> 0 | AS67: =X67 -> 0
AO68: =H68 -> 0 | AP68: =L68 -> 0 | AQ68: =P68 -> 0 | AR68: =T68 -> 0 | AS68: =X68 -> 0
AO69: =H69 -> 0 | AP69: =L69 -> 0 | AQ69: =P69 -> 0 | AR69: =T69 -> 0 | AS69: =X69 -> 0
AO70: =H70 -> 0 | AP70: =L70 -> 0 | AQ70: =P70 -> 0 | AR70: =T70 -> 0 | AS70: =X70 -> 0
AO71: =H71 -> 0 | AP71: =L71 -> 0 | AQ71: =P71 -> 0 | AR71: =T71 -> 0 | AS71: =X71 -> 0
AO72: =H72 -> 0 | AP72: =L72 -> 0 | AQ72: =P72 -> 0 | AR72: =T72 -> 0 | AS72: =X72 -> 0
AO73: =H73 -> 0 | AP73: =L73 -> 0 | AQ73: =P73 -> 0 | AR73: =T73 -> 0 | AS73: =X73 -> 0
AO74: =H74 -> 0 | AP74: =L74 -> 0 | AQ74: =P74 -> 0 | AR74: =T74 -> 0 | AS74: =X74 -> 0
AO75: =H75 -> 0 | AP75: =L75 -> 0 | AQ75: =P75 -> 0 | AR75: =T75 -> 0 | AS75: =X75 -> 0
AO76: =H76 -> 0 | AP76: =L76 -> 0 | AQ76: =P76 -> 0 | AR76: =T76 -> 0 | AS76: =X76 -> 0
AO77: =H77 -> 0 | AP77: =L77 -> 0 | AQ77: =P77 -> 0 | AR77: =T77 -> 0 | AS77: =X77 -> 0
AO78: =H78 -> 0 | AP78: =L78 -> 0 | AQ78: =P78 -> 0 | AR78: =T78 -> 0 | AS78: =X78 -> 0
AO79: =H79 -> 0 | AP79: =L79 -> 0 | AQ79: =P79 -> 0 | AR79: =T79 -> 0 | AS79: =X79 -> 0
AO80: =H80 -> 0 | AP80: =L80 -> 0 | AQ80: =P80 -> 0 | AR80: =T80 -> 0 | AS80: =X80 -> 0
AO81: =H81 -> 0 | AP81: =L81 -> 0 | AQ81: =P81 -> 0 | AR81: =T81 -> 0 | AS81: =X81 -> 0
AO82: =H82 -> 0 | AP82: =L82 -> 0 | AQ82: =P82 -> 0 | AR82: =T82 -> 0 | AS82: =X82 -> 0
AO83: =H83 -> 0 | AP83: =L83 -> 0 | AQ83: =P83 -> 0 | AR83: =T83 -> 0 | AS83: =X83 -> 0
AO84: =H84 -> 0 | AP84: =L84 -> 0 | AQ84: =P84 -> 0 | AR84: =T84 -> 0 | AS84: =X84 -> 0
AO85: =H85 -> 0 | AP85: =L85 -> 0 | AQ85: =P85 -> 0 | AR85: =T85 -> 0 | AS85: =X85 -> 0
AO86: =H86 -> 0 | AP86: =L86 -> 0 | AQ86: =P86 -> 0 | AR86: =T86 -> 0 | AS86: =X86 -> 0
AO87: =H89 -> 0 | AP87: =L89 -> 0 | AQ87: =P89 -> 0 | AR87: =T89 -> 0 | AS87: =X89 -> 0
AO88: =H90 -> 0 | AP88: =L90 -> 0 | AQ88: =P90 -> 0 | AR88: =T90 -> 0 | AS88: =X90 -> 0
AO89: =H91 -> 0 | AP89: =L91 -> 0 | AQ89: =P91 -> 0 | AR89: =T91 -> 0 | AS89: =X91 -> 0
AO90: =H92 -> 0 | AP90: =L92 -> 0 | AQ90: =P92 -> 0 | AR90: =T92 -> 0 | AS90: =X92 -> 0
AO91: =H93 -> 0 | AP91: =L93 -> 0 | AQ91: =P93 -> 0 | AR91: =T93 -> 0 | AS91: =X93 -> 0
AO92: =H94 -> 0 | AP92: =L94 -> 0 | AQ92: =P94 -> 0 | AR92: =T94 -> 0 | AS92: =X94 -> 0
AO93: =H95 -> 0 | AP93: =L95 -> 0 | AQ93: =P95 -> 0 | AR93: =T95 -> 0 | AS93: =X95 -> 0
AO94: =H96 -> 0 | AP94: =L96 -> 0 | AQ94: =P96 -> 0 | AR94: =T96 -> 0 | AS94: =X96 -> 0
AO95: =H97 -> 0 | AP95: =L97 -> 0 | AQ95: =P97 -> 0 | AR95: =T97 -> 0 | AS95: =X97 -> 0
AO96: =H98 -> 0 | AP96: =L98 -> 0 | AQ96: =P98 -> 0 | AR96: =T98 -> 0 | AS96: =X98 -> 0
AO97: =H99 -> 0 | AP97: =L99 -> 0 | AQ97: =P99 -> 0 | AR97: =T99 -> 0 | AS97: =X99 -> 0
AO98: =H100 -> 0 | AP98: =L100 -> 0 | AQ98: =P100 -> 0 | AR98: =T100 -> 0 | AS98: =X100 -> 0
AO99: =H101 -> 0 | AP99: =L101 -> 0 | AQ99: =P101 -> 0 | AR99: =T101 -> 0 | AS99: =X101 -> 0
AO100: =H102 -> 0 | AP100: =L102 -> 0 | AQ100: =P102 -> 0 | AR100: =T102 -> 0 | AS100: =X102 -> 0